{"resource": "8F2K1QW7ZJ/e3", "source": "publisher-toc", "snapshot": "blake3:0000000000000000000000000000000000000000000000000000000000000000", "nodes": [{"key": "3", "kind": "chapter", "number": "3", "title": "Numerical Sequences and Series", "children": [{"key": "3.14", "kind": "section", "number": "3.14", "title": "Series", "children": [{"key": "thm-3.14", "kind": "theorem", "number": "3.14"}]}]}]}